{
  "benchmark_version": "1.1",
  "generated_at": "2026-07-18T19:34:42.768469Z",
  "matrix_identity": {
    "enforced_in": "ci-matrix-comparison",
    "identical": null,
    "observed_combinations": 1,
    "required_combinations": 4
  },
  "passed": true,
  "schema_version": "1",
  "suites": {
    "detection": {
      "counts": {
        "failed": 107,
        "incomplete": 0,
        "passed": 181,
        "total": 288
      },
      "metrics": {
        "absolute_error_reduction": 0.7430555555555556,
        "capability_exact_accuracy": 1.0,
        "configured_error_rate": 0.0,
        "improved_repositories": 12,
        "incomplete_scan_present": false,
        "legacy_error_rate": 0.7430555555555556,
        "project_type_mean_regression_present": false,
        "project_type_mean_regressions": 0,
        "relative_error_reduction": 1.0,
        "repository_count": 12,
        "scan_complete": true,
        "source_false_negative_rate": 0.0,
        "source_false_positive_rate": 0.0,
        "test_false_negative_rate": 0.0,
        "test_false_positive_rate": 0.0
      },
      "passed": true,
      "thresholds": {
        "allow_project_type_mean_regression": false,
        "capability_min_exact_accuracy": 0.95,
        "configured_max_error_rate": 0.05,
        "incomplete_scan_counts_as_pass": false,
        "min_absolute_error_reduction": 0.1,
        "min_improved_repositories": 6,
        "min_relative_error_reduction": 0.5,
        "repository_count": 12,
        "source_max_false_negative_rate": 0.05,
        "source_max_false_positive_rate": 0.05,
        "test_max_false_negative_rate": 0.05,
        "test_max_false_positive_rate": 0.05
      }
    },
    "evidence": {
      "counts": {
        "failed": 0,
        "incomplete": 0,
        "passed": 48,
        "total": 48
      },
      "metrics": {
        "clean_false_blocks": 0,
        "clean_total": 16,
        "defect_total": 32,
        "defects_detected": 32,
        "false_block_rate": 0.0,
        "supported_defect_recall": 1.0
      },
      "passed": true,
      "thresholds": {
        "clean_total": 16,
        "defect_recall_required": 32,
        "defect_total": 32,
        "false_blocks_allowed": 0
      }
    },
    "migration": {
      "counts": {
        "failed": 0,
        "incomplete": 0,
        "passed": 64,
        "total": 64
      },
      "metrics": {
        "config_validation_passed": 12,
        "failure_atomicity_passed": 4,
        "failure_atomicity_total": 4,
        "force_idempotence_passed": 12,
        "independent_output_parity_passed": 12,
        "minimum_property_pass_count": 12,
        "property_count": 5,
        "semantic_migration_invariant_passed": 12,
        "tree_atomicity_passed": 12,
        "valid_fixture_count": 12
      },
      "passed": true,
      "thresholds": {
        "case_total": 12,
        "cases_required_per_property": 12,
        "failure_atomicity_required": 4,
        "failure_atomicity_total": 4,
        "property_count": 5,
        "semantic_migration_invariant_required": true
      }
    },
    "mutations": {
      "counts": {
        "failed": 0,
        "incomplete": 0,
        "passed": 68,
        "total": 68
      },
      "metrics": {
        "clean_blocked": 0,
        "clean_false_block_rate": 0.0,
        "clean_total": 13,
        "gap_detect_only_detected": 2,
        "gap_detect_only_total": 2,
        "gap_known_unenforced_detected": 0,
        "gap_known_unenforced_total": 2,
        "gap_probe_blocked": 0,
        "gap_probe_detected": 2,
        "gap_probe_total": 4,
        "kill_rate": 1.0,
        "must_block_killed": 51,
        "must_block_total": 51
      },
      "passed": true,
      "thresholds": {
        "clean_blocked_allowed": 0,
        "clean_total": 13,
        "gap_probe_total": 4,
        "gap_probes_required": 4,
        "killed_required": 51,
        "mutation_total": 51
      }
    }
  },
  "toolchain": {
    "garden_commit": "9b4c260b83652395765a8a194ec7c005aa306514",
    "platform": "macos",
    "plugin_version": "0.10.1",
    "python_version": "3.14.0",
    "repository_commit": "e8d5bc838ae40ba5c76fbe79c895c55da748e896",
    "seed": 20260714
  }
}
